{
  "format": "scrylux",
  "format_version": 1,
  "exported_at": "2026-10-12T07:08:40.396Z",
  "project": {
    "name": "Scrylux demo (fictional)"
  },
  "threat_model": {
    "name": "Notes app (fictional demo)",
    "methodology": "STRIDE",
    "status": "in_review"
  },
  "elements": [
    {
      "id": "ce6a3901-19e3-43ea-abdc-a20b85471253",
      "type": "trust_boundary",
      "name": "Cloud account",
      "properties": {},
      "layout": {
        "x": 20,
        "y": 140,
        "width": 480,
        "height": 440
      },
      "parent_boundary_id": null,
      "source_element_id": null,
      "target_element_id": null
    },
    {
      "id": "3ae2f4de-1a44-4000-989a-fd53224dd2ac",
      "type": "trust_boundary",
      "name": "Private subnet",
      "properties": {},
      "layout": {
        "x": 235,
        "y": 50,
        "width": 220,
        "height": 360
      },
      "parent_boundary_id": "ce6a3901-19e3-43ea-abdc-a20b85471253",
      "source_element_id": null,
      "target_element_id": null
    },
    {
      "id": "a72be176-15dd-4c09-8ba8-4183ea1efb1d",
      "type": "external_entity",
      "name": "Email provider",
      "properties": {
        "flags": {
          "authenticated": true,
          "internet_facing": true
        }
      },
      "layout": {
        "x": 190,
        "y": 640
      },
      "parent_boundary_id": null,
      "source_element_id": null,
      "target_element_id": null
    },
    {
      "id": "6915725d-46fc-477a-a566-094eaa0116e9",
      "type": "external_entity",
      "name": "Note taker",
      "properties": {
        "flags": {
          "authenticated": true,
          "internet_facing": true
        }
      },
      "layout": {
        "x": 40,
        "y": 20
      },
      "parent_boundary_id": null,
      "source_element_id": null,
      "target_element_id": null
    },
    {
      "id": "83ddd98c-63fc-4d91-9bd2-732a7e4c0055",
      "type": "process",
      "name": "Notes API",
      "properties": {
        "tags": [
          "Node.js",
          "REST"
        ],
        "flags": {
          "handles_sensitive_data": true,
          "internet_facing": true,
          "requires_authentication": true,
          "runs_privileged": false
        }
      },
      "layout": {
        "x": 30,
        "y": 70
      },
      "parent_boundary_id": "ce6a3901-19e3-43ea-abdc-a20b85471253",
      "source_element_id": null,
      "target_element_id": null
    },
    {
      "id": "9e87ff4d-56f8-478d-acf1-c0eacc97ef67",
      "type": "process",
      "name": "Reminder worker",
      "properties": {
        "tags": [
          "Node.js"
        ],
        "flags": {
          "handles_sensitive_data": true,
          "requires_authentication": true,
          "runs_privileged": false
        }
      },
      "layout": {
        "x": 30,
        "y": 300
      },
      "parent_boundary_id": "ce6a3901-19e3-43ea-abdc-a20b85471253",
      "source_element_id": null,
      "target_element_id": null
    },
    {
      "id": "82b6d6c3-c0a0-4bef-b6a1-73b1514fb700",
      "type": "process",
      "name": "Web app",
      "properties": {
        "tags": [
          "React"
        ],
        "flags": {
          "handles_sensitive_data": true,
          "internet_facing": true,
          "requires_authentication": true
        }
      },
      "layout": {
        "x": 280,
        "y": 20
      },
      "parent_boundary_id": null,
      "source_element_id": null,
      "target_element_id": null
    },
    {
      "id": "c898a546-cdd9-4653-9be3-f9de22f0aebe",
      "type": "data_store",
      "name": "Attachment bucket",
      "properties": {
        "tags": [
          "Object storage"
        ],
        "flags": {
          "encrypted_at_rest": false,
          "internet_facing": false,
          "stores_sensitive_data": true
        }
      },
      "layout": {
        "x": 40,
        "y": 240
      },
      "parent_boundary_id": "3ae2f4de-1a44-4000-989a-fd53224dd2ac",
      "source_element_id": null,
      "target_element_id": null
    },
    {
      "id": "0951fe5f-928f-49b2-be7c-9fef510873ff",
      "type": "data_store",
      "name": "Notes database",
      "properties": {
        "tags": [
          "PostgreSQL"
        ],
        "flags": {
          "encrypted_at_rest": true,
          "internet_facing": false,
          "stores_sensitive_data": true
        }
      },
      "layout": {
        "x": 40,
        "y": 70
      },
      "parent_boundary_id": "3ae2f4de-1a44-4000-989a-fd53224dd2ac",
      "source_element_id": null,
      "target_element_id": null
    },
    {
      "id": "25c37d29-08c7-44dd-9cb6-d2044727c9e5",
      "type": "data_flow",
      "name": "Attachment upload and download",
      "properties": {
        "tags": [
          "HTTPS"
        ],
        "flags": {
          "authenticated": true,
          "carries_sensitive_data": true,
          "encrypted_in_transit": true
        }
      },
      "layout": null,
      "parent_boundary_id": null,
      "source_element_id": "83ddd98c-63fc-4d91-9bd2-732a7e4c0055",
      "target_element_id": "c898a546-cdd9-4653-9be3-f9de22f0aebe"
    },
    {
      "id": "ec486d5f-a529-4755-8ac8-d2b17cd01913",
      "type": "data_flow",
      "name": "Queries and updates",
      "properties": {
        "tags": [
          "SQL"
        ],
        "flags": {
          "authenticated": true,
          "carries_sensitive_data": true,
          "encrypted_in_transit": true
        }
      },
      "layout": null,
      "parent_boundary_id": null,
      "source_element_id": "83ddd98c-63fc-4d91-9bd2-732a7e4c0055",
      "target_element_id": "0951fe5f-928f-49b2-be7c-9fef510873ff"
    },
    {
      "id": "41b71ee9-5fcf-44fe-9b82-4e7635b185d6",
      "type": "data_flow",
      "name": "Reads due reminders",
      "properties": {
        "tags": [
          "SQL"
        ],
        "flags": {
          "authenticated": true,
          "carries_sensitive_data": true,
          "encrypted_in_transit": false
        }
      },
      "layout": null,
      "parent_boundary_id": null,
      "source_element_id": "9e87ff4d-56f8-478d-acf1-c0eacc97ef67",
      "target_element_id": "0951fe5f-928f-49b2-be7c-9fef510873ff"
    },
    {
      "id": "daca71e8-b91e-4a52-bd81-a1875a0983a4",
      "type": "data_flow",
      "name": "Schedules reminders",
      "properties": {
        "flags": {
          "authenticated": true
        }
      },
      "layout": null,
      "parent_boundary_id": null,
      "source_element_id": "83ddd98c-63fc-4d91-9bd2-732a7e4c0055",
      "target_element_id": "9e87ff4d-56f8-478d-acf1-c0eacc97ef67"
    },
    {
      "id": "e2ba9fcc-3adb-47d9-9cba-445d794cbcd3",
      "type": "data_flow",
      "name": "Sends reminder emails",
      "properties": {
        "tags": [
          "SMTP"
        ],
        "flags": {
          "authenticated": true,
          "carries_sensitive_data": false,
          "encrypted_in_transit": true
        }
      },
      "layout": null,
      "parent_boundary_id": null,
      "source_element_id": "9e87ff4d-56f8-478d-acf1-c0eacc97ef67",
      "target_element_id": "a72be176-15dd-4c09-8ba8-4183ea1efb1d"
    },
    {
      "id": "c07ef76d-439e-4f0a-ba33-d57a4b33d242",
      "type": "data_flow",
      "name": "Sign-in and note requests",
      "properties": {
        "tags": [
          "HTTPS"
        ],
        "flags": {
          "authenticated": true,
          "carries_sensitive_data": true,
          "encrypted_in_transit": true
        }
      },
      "layout": null,
      "parent_boundary_id": null,
      "source_element_id": "82b6d6c3-c0a0-4bef-b6a1-73b1514fb700",
      "target_element_id": "83ddd98c-63fc-4d91-9bd2-732a7e4c0055"
    },
    {
      "id": "f1d18047-16e0-4f6b-8ec0-2a873a052ca9",
      "type": "data_flow",
      "name": "Writes and reads notes",
      "properties": {
        "flags": {
          "authenticated": true
        }
      },
      "layout": null,
      "parent_boundary_id": null,
      "source_element_id": "6915725d-46fc-477a-a566-094eaa0116e9",
      "target_element_id": "82b6d6c3-c0a0-4bef-b6a1-73b1514fb700"
    }
  ],
  "threats": [
    {
      "id": "2a33f9c2-20db-48fd-8cc9-49dfe21dd19c",
      "element_id": "a72be176-15dd-4c09-8ba8-4183ea1efb1d",
      "category": "Spoofing",
      "title": "Reused passwords let attackers sign in as Email provider",
      "description": "Email provider authenticates over the public internet. Attackers try passwords leaked from other services against it, and anyone who reuses a password is exposed even though nothing in this system was breached.",
      "likelihood": "Medium",
      "impact": "Medium",
      "status": "not_applicable",
      "status_reason": "The Reminder worker signs in to the provider with an API key issued per deployment, never with a password a person types, so there is no password to reuse.",
      "origin": "rule",
      "library_ref": "ee-spoofing-credential-stuffing",
      "stale": null
    },
    {
      "id": "d868ae72-480f-40e4-881f-9f79024d5927",
      "element_id": "a72be176-15dd-4c09-8ba8-4183ea1efb1d",
      "category": "Spoofing",
      "title": "Stolen credentials let an attacker act as Email provider",
      "description": "Email provider proves who it is with a credential such as a password, key or token. If that credential is stolen, leaked or guessed, the attacker is indistinguishable from the real entity until someone notices.",
      "likelihood": "Medium",
      "impact": "High",
      "status": "open",
      "status_reason": null,
      "origin": "rule",
      "library_ref": "ee-spoofing-stolen-credentials",
      "stale": null
    },
    {
      "id": "55980c68-c29b-44b0-ad40-f2ca5838ec17",
      "element_id": "a72be176-15dd-4c09-8ba8-4183ea1efb1d",
      "category": "Repudiation",
      "title": "Email provider can deny having done something",